feature,population,spread_partial_r,spread_signal,ou_partial_r,ou_signal,traj_games_2_4_spread_r,traj_games_2_4_ou_r,variance_signal_spread,variance_signal_ou,yoy_r,yoy_stable,verdict,notes
last3_off_epa_avg,Conference games 2+ (non-null),0.0867,False,0.0332,False,0.1268,0.0123,False,False,,False,"conference-specific — signal in ['ACC', 'Mid-American', 'SEC'], redundant in ['American Athletic', 'Big 12', 'Big Ten', 'Conference USA', 'Mountain West', 'Pac-12', 'Sun Belt']",Opponent adjustment handled by opp_sp_rating_at_game_time control.
last3_def_epa_avg,Conference games 2+ (non-null),-0.1148,True,0.0601,False,-0.1256,0.0704,False,False,,False,"conference-specific supporting — signal holds from conf game 2, concentrates in ['American Athletic', 'Big Ten', 'Conference USA', 'Mid-American', 'Pac-12', 'Sun Belt']",Opponent adjustment handled by opp_sp_rating_at_game_time control.
last3_points_scored_avg,Conference games 2+ (non-null),0.1009,True,0.0684,False,0.1179,0.0429,False,False,,False,"conference-specific supporting — signal holds from conf game 2, concentrates in ['ACC', 'American Athletic', 'Big 12', 'Big Ten', 'Conference USA', 'Mid-American']",
last3_points_allowed_avg,Conference games 2+ (non-null),-0.1386,True,0.0824,False,-0.1441,0.0747,False,False,,False,"supporting — in-season only, signal holds from conf game 2, no prior seed",
last3_win_pct,Conference games 2+ (non-null),0.1398,True,-0.0082,False,0.144,-0.01,False,False,,False,"supporting — in-season only, signal holds from conf game 2, no prior seed",
days_since_last_game,All conf games,0.0083,False,0.0115,False,,,False,False,,False,"conference-specific — bye week signal in ['Big 12', 'Mid-American', 'Mountain West']","All games: spread r=0.0083. Bye week (n=552): spread r=0.0045. Conferences with bye signal: ['Big 12', 'Mid-American', 'Mountain West']."
